{
  "openmhs_registry": "0.1",
  "id": "openmhs.py.psu-sim",
  "name": "Python example power supply (out of process)",
  "protocol": "other",
  "maintainer": "KNambiarDJsc",
  "source": "adapters/python/psu-sim",
  "profiles": [
    "adapters/python/psu-sim/manifest.json"
  ],
  "version": "0.1.0",
  "license": "Apache-2.0",
  "conformance_profile": "L3",
  "category": "official",
  "peer": "in-process-simulator",
  "report": {
    "path": "conformance/reports/py.psu-01/2026-10-24-v0.1.0-windows-x86_64.json",
    "sha256": "2b64f5400f032aa97a7243a6f566827ffcb2309ff4b5525eb3b3a34164e58e6d",
    "verified_at": "2026-10-24"
  },
  "notes": "Written with the Python adapter SDK and run through the adapter host. Drives its own simulator."
}
